{
  "record_id": "record_01j00000000000000000000001",
  "registry_schema_version": "artifact_record_v1.0.0",
  "record_revision": 1,
  "recorded_at": "2026-01-01T00:01:00Z",
  "previous_record_id": null,
  "previous_record_hash": null,
  "record_hash": "2f2184664dca0a277ec6a22d244b0e379e9f0ac04a137f533e212866b8aa2540",
  "artifact_id": "artifact_01j00000000000000000000001",
  "artifact_type": "run.identity",
  "logical_name": "Synthetic public run identity",
  "container_kind": "file",
  "project_version": "v0.2",
  "storage_version": "V02",
  "release_version": "truthfulness_v0.2_youtube_video",
  "source_platform": "youtube",
  "source_id": "youtube_synth3tic01",
  "run_id": "run_01j00000000000000000000000",
  "batch_id": null,
  "dataset_build_id": null,
  "dataset_version": null,
  "experiment_id": null,
  "stage_id": "S01",
  "dag_node_id": "source_identity",
  "relative_path": "examples/artifact_registry/synthetic_run/run.json",
  "storage_scope": "run",
  "media_type": "application/json",
  "size_bytes": 606,
  "content_hash_algorithm": "sha256",
  "content_hash": "eab481f13321827c3cb791406938808063cd357e306c342081c39b7dbb4f540e",
  "semantic_hash_algorithm": null,
  "semantic_hash": null,
  "entity_index_artifact_id": null,
  "producer_type": "migration",
  "writer_agent_id": null,
  "agent_version": null,
  "workflow_id": "S01",
  "workflow_version": "youtube_truthfulness_workflow_v1.0.0",
  "schema_versions": [
    "run_identity_v1",
    "artifact_record_v1.0.0"
  ],
  "prompt_id": null,
  "prompt_version": null,
  "dag_version": "youtube_truthfulness_dag_v1.0.0",
  "code_commit": null,
  "tool_versions": {
    "artifact_core": "synthetic-example-v1"
  },
  "parameters_hash": null,
  "upstream_artifact_ids": [],
  "upstream_entity_refs": [],
  "input_fingerprint": null,
  "authority_level": "human_authoritative",
  "lifecycle_state": "validated",
  "validation_status": "passed",
  "validation_artifact_ids": [],
  "privacy_class": "public_synthetic",
  "access_scope": "public",
  "retention_policy": "retain with public synthetic examples",
  "created_at": "2026-01-01T00:00:00Z",
  "validated_at": "2026-01-01T00:01:00Z",
  "frozen_at": null,
  "archived_at": null,
  "supersedes": [],
  "change_reason": null,
  "metadata_revision_reason": null
}
